Title,Series,Description,url
R for Beginners,Data,This series of introductory workshops are intended for individuals with little to no familiarity with R or similar tools that rely on a scripted environment. They are intended as a low barrier entry into the world of using your computer to engage with data outside of graphical tools like Excel or SPSS.,https://csc-ubc-okanagan.github.io/R-for-beginners/
Python for Beginners,Data,This series of introductory workshops are intended for individuals with little to no familiarity with Python or similar tools that rely on a scripted environment. They are intended as a low barrier entry into the world of using your computer to engage with data outside of graphical tools like Excel or SPSS.,https://csc-ubc-okanagan.github.io/Python-for-beginners/
Research Data Management,Researcher Toolkit,"This session is the first of a  three-part series on RDM, and is part of the larger Researcher Toolkit series, an eight-part series which aims to introduce participants to a variety of research tools and concepts, and build core competencies applicable across the research lifecycle. ",https://csc-ubc-okanagan.github.io/
Introduction to the Unix Shell,Researcher Toolkit,"This session is the first of a two-part series on the Unix Shell, and is part of the larger Researcher Toolkit series, an eight-part series which aims to introduce participants to a variety of research tools and concepts, and build core competencies applicable across the research lifecycle.",https://csc-ubc-okanagan.github.io/
Introduction to GitHub and Git Pages,Researcher Toolkit,"This session is the first of a three-part series on GitHub and GitHub pages, and is part of the larger Researcher Toolkit series, an eight-part series which aims to introduce participants to a variety of research tools and concepts, and build core competencies applicable across the research lifecycle.",https://csc-ubc-okanagan.github.io/